{
  "$schema": "https://json-schema.org/draft/2020-12/schema",
  "$id": "https://weezmo.vercel.app/schemas/customer-survey-payload.json",
  "title": "CustomerSurveyPayload",
  "type": "object",
  "additionalProperties": false,
  "required": ["template_id", "title", "questions"],
  "properties": {
    "template_id": {
      "type": "string",
      "const": "customer_survey"
    },
    "title": {
      "type": "string",
      "minLength": 1
    },
    "subtitle": {
      "type": "string"
    },
    "logoUrl": {
      "type": "string",
      "format": "uri"
    },
    "order_id": {
      "type": "string",
      "minLength": 1,
      "maxLength": 256,
      "description": "External correlation id (e.g. Shopify order id). Echoed on survey-submit webhook."
    },
    "branch_id": {
      "type": "string",
      "minLength": 1,
      "maxLength": 120,
      "description": "Stored on documents + survey_responses for admin filters."
    },
    "customer_name": {
      "type": "string",
      "minLength": 1,
      "maxLength": 200,
      "description": "Searchable in admin backoffice."
    },
    "customer_phone": {
      "type": "string",
      "minLength": 1,
      "maxLength": 40,
      "description": "Searchable in admin backoffice."
    },
    "questions": {
      "type": "array",
      "minItems": 1,
      "maxItems": 20,
      "items": {
        "type": "object",
        "additionalProperties": false,
        "required": ["id", "text", "required"],
        "properties": {
          "id": {
            "type": "string",
            "minLength": 1
          },
          "text": {
            "type": "string",
            "minLength": 1
          },
          "required": {
            "type": "boolean"
          }
        }
      }
    },
    "metadata": {
      "type": "object",
      "additionalProperties": true
    }
  }
}
