{
  "template_id": "customer_survey",
  "title": "סקר שביעות רצון",
  "subtitle": "דעתך חשובה לנו ❤️",
  "order_id": "shopify-order-5678901234",
  "branch_id": "3000",
  "customer_name": "תמר שני",
  "customer_phone": "0501234567",
  "questions": [
    {
      "id": "q_service",
      "text": "דרג את שביעות רצונך מהשירות שקיבלת",
      "required": true
    },
    {
      "id": "q_rep",
      "text": "דרג את שביעות רצונך מאדיבות ומקצועיות הנציג",
      "required": true
    },
    {
      "id": "q_speed",
      "text": "דרג את שביעות רצונך ממהירות התגובה",
      "required": true
    },
    {
      "id": "q_solution",
      "text": "דרג באיזו מידה הפתרון שקיבלת היה ברור, יעיל ומספק",
      "required": true
    }
  ],
  "metadata": {
    "channel": "sms_post_purchase"
  }
}
